,date,precipitation,temp_max,temp_min,wind,weather,weather_summary
0,2012-01-01,0.0,12.8,5.0,4.7,drizzle,"Today’s weather is characterized by light drizzle, creating a damp atmosphere throughout the day. Overcast skies dominate, limiting sunlight and contributing to a cooler temperature, which is typical for such weather conditions. The humidity levels are elevated due to the persistent drizzle, enhancing the overall chill in the air. Winds are mild, adding to the dreary feel of the day. Overall, it’s a gray and wet day, perfect for indoor activities or enjoying a warm beverage."
1,2012-01-02,10.9,10.6,2.8,4.5,rain,"On this day, the weather is characterized by overcast skies and consistent rainfall, creating a cool and damp atmosphere. Temperatures are moderate, hovering around the low to mid-60s Fahrenheit, with humidity levels high due to the persistent precipitation. Wind speeds are light, enhancing the cozy, albeit gloomy feel of the day. The combination of rain and cloud cover limits visibility and contributes to a sense of calm, making it an ideal time for indoor activities or a leisurely stroll with an umbrella."
2,2012-01-03,0.8,11.7,7.2,2.3,rain,"I would be happy to help! However, I need the specific data or details regarding the weather conditions you are referring to. Could you please provide that information?"
3,2012-01-04,20.3,12.2,5.6,4.7,rain,"Today, weather conditions are characterized by consistent rainfall throughout the day, with overcast skies prevailing. Expect moderate to heavy showers at times, contributing to a damp and cool atmosphere. Temperatures are likely to hover around 15-18°C (59-64°F), creating a chilly environment particularly in the absence of sunlight. Wind speeds are moderate, enhancing the feeling of dampness. Overall, it’s advisable to stay indoors or be well-prepared with waterproof clothing if venturing outside, as the rain is expected to persist into the evening."
4,2012-01-05,1.3,8.9,2.8,6.1,rain,"Sure! However, I need the specific data related to today's rain or any other relevant weather conditions you want me to summarize. Please provide that information, and I’ll be happy to create a summary for you!"
